{
  "$schema": "https://json-schema.org/draft/2020-12/schema",
  "$id": "https://github.com/Kewton/commandmate-skills/blob/main/skills/cmate-issue-authoring/schemas/issue-split-plan.v1.json",
  "title": "cmate-issue-authoring issue split plan v1",
  "description": "Read-only split plan produced by Phase 1 of cmate-issue-authoring: the Issues a Feature description would become, before any of them exists on GitHub. Closed schema: an unknown field is a contract violation, not something a reader may ignore. Machine-checked by scripts/validate-plan.mjs, which additionally enforces the rules a JSON Schema cannot state (dependency acyclicity, planner readiness of each rendered body, the dry-run mutation ban).",
  "type": "object",
  "additionalProperties": false,
  "required": [
    "plan_schema_version",
    "skill_id",
    "skill_version",
    "plan_id",
    "generated_mode",
    "repository",
    "source",
    "issues",
    "duplicate_suspicions",
    "open_questions",
    "commands",
    "warnings",
    "notes"
  ],
  "properties": {
    "plan_schema_version": { "const": 1 },
    "skill_id": { "const": "cmate-issue-authoring" },
    "skill_version": { "type": "string", "pattern": "^[0-9]+\\.[0-9]+\\.[0-9]+$" },
    "plan_id": {
      "type": "string",
      "pattern": "^split-[0-9a-f]{12}$",
      "description": "Identity of this plan, derived from repository, source.digest and the issue keys. Phase 2 records it in the registration receipt, and a second registration of the same plan_id is refused."
    },
    "generated_mode": {
      "const": "dry-run",
      "description": "v1 has exactly one mode. A plan is always the read-only artifact; registration is a separate action that consumes it and never rewrites it."
    },
    "repository": {
      "type": "string",
      "pattern": "^[A-Za-z0-9._-]+/[A-Za-z0-9._-]+$",
      "description": "The repository the Issues would be created in. Never inferred from the working directory name."
    },
    "source": { "$ref": "#/$defs/source" },
    "issues": {
      "type": "array",
      "minItems": 1,
      "items": { "$ref": "#/$defs/issue" }
    },
    "duplicate_suspicions": {
      "type": "array",
      "description": "Existing Issues and merged PRs that overlap a planned Issue. Empty means the search ran and found nothing, not that it was skipped: a skipped search is a warning.",
      "items": { "$ref": "#/$defs/duplicate_suspicion" }
    },
    "open_questions": {
      "type": "array",
      "description": "Decisions the author refused to make on the user's behalf.",
      "items": { "$ref": "#/$defs/open_question" }
    },
    "commands": {
      "type": "array",
      "description": "The commands this plan rests on. In dry-run every entry is read-only; the validator refuses a plan that records a mutating one.",
      "items": { "$ref": "#/$defs/command" }
    },
    "warnings": { "type": "array", "items": { "$ref": "#/$defs/note_entry" } },
    "notes": { "type": "array", "items": { "type": "string", "minLength": 1 } }
  },
  "$defs": {
    "issue_key": {
      "type": "string",
      "maxLength": 64,
      "pattern": "^[a-z0-9]+(?:-[a-z0-9]+)*$",
      "description": "Stable handle for a planned Issue inside this plan. Issue numbers do not exist yet, so dependencies are expressed with keys."
    },
    "repo_path": {
      "type": "string",
      "minLength": 1,
      "description": "Repository-relative POSIX path. No leading slash, no backslash, no control character and no '..' segment: a plan must not name anything outside the target repository.",
      "pattern": "^(?!.*(?:^|/)\\.\\.(?:/|$))[^/\\\\\\u0000-\\u001f\\u007f][^\\\\\\u0000-\\u001f\\u007f]*$"
    },
    "trace_ref": {
      "type": "string",
      "minLength": 1,
      "description": "Where a claim comes from: a repository-relative path (optionally 'path:line'), or a locator inside the caller-supplied input.",
      "pattern": "^[^\\\\\\u0000-\\u001f\\u007f]+$"
    },
    "note_entry": {
      "type": "object",
      "additionalProperties": false,
      "required": ["code", "detail"],
      "properties": {
        "code": { "type": "string", "minLength": 1 },
        "detail": { "type": "string", "minLength": 1 }
      }
    },
    "source": {
      "type": "object",
      "additionalProperties": false,
      "required": ["kind", "ref", "digest"],
      "properties": {
        "kind": {
          "enum": ["text", "file", "epic_issue"],
          "description": "text: a Feature description passed inline. file: a path in the checkout. epic_issue: an Issue read read-only with gh."
        },
        "ref": { "type": "string", "minLength": 1 },
        "digest": {
          "type": "string",
          "pattern": "^[0-9a-f]{64}$",
          "description": "SHA-256 of the exact input bytes the split was derived from. Two runs over the same Feature description produce the same digest, which is what makes plan_id a duplicate-registration guard rather than a label."
        }
      }
    },
    "issue": {
      "type": "object",
      "additionalProperties": false,
      "required": [
        "key",
        "title",
        "objective",
        "acceptance_criteria",
        "target_files",
        "reference_files",
        "test_expectations",
        "depends_on",
        "labels",
        "size",
        "parallel_safe",
        "evidence",
        "body"
      ],
      "properties": {
        "key": { "$ref": "#/$defs/issue_key" },
        "title": { "type": "string", "minLength": 1, "maxLength": 200 },
        "objective": {
          "type": "string",
          "minLength": 1,
          "description": "One sentence. It is also the first non-empty line of body, because that is what the cmate-orchestrate planner reads as the objective."
        },
        "acceptance_criteria": {
          "type": "array",
          "minItems": 1,
          "items": { "type": "string", "minLength": 1 }
        },
        "target_files": {
          "type": "array",
          "minItems": 1,
          "description": "Files this Issue is expected to change. At least one must be a non-documentation path, or the planner cannot suspect a file and raises a blocking question. An Issue labelled human-only is exempt: a person does it, and it is never passed to the planner.",
          "items": { "$ref": "#/$defs/repo_path" }
        },
        "reference_files": {
          "type": "array",
          "description": "Files to read for context. Documentation paths belong here, not in target_files.",
          "items": { "$ref": "#/$defs/repo_path" }
        },
        "test_expectations": {
          "type": "array",
          "description": "Commands that decide whether the Issue is done.",
          "items": { "type": "string", "minLength": 1 }
        },
        "depends_on": {
          "type": "array",
          "description": "Keys of Issues in this plan that must land first. Explicit only: nothing is inferred here, because inference belongs to the planner.",
          "items": { "$ref": "#/$defs/issue_key" }
        },
        "labels": { "type": "array", "items": { "type": "string", "minLength": 1 } },
        "size": {
          "enum": ["xs", "s", "m", "l"],
          "description": "The same bands cmate-issue-refinement uses. Its 'xl' ('do not estimate further, enumerate the slices') and its 'unknown' are deliberately absent: this plan describes slices that have already been cut, so either value would mean the split is unfinished. See references/plan-contract.md section 7."
        },
        "parallel_safe": {
          "enum": ["yes", "no", "unknown"],
          "description": "'unknown' when no shared write target was found and no evidence rules one out. Absence of evidence is not 'yes'. Maps one-to-one onto cmate-issue-refinement's dependencies.parallel_safe: yes=true, no=false, unknown='unknown'. See references/plan-contract.md section 7."
        },
        "evidence": {
          "type": "array",
          "minItems": 1,
          "description": "Every claim this Issue makes traces to the caller-supplied input or to a file that was actually read.",
          "items": {
            "type": "object",
            "additionalProperties": false,
            "required": ["claim", "kind", "ref"],
            "properties": {
              "claim": { "type": "string", "minLength": 1 },
              "kind": { "enum": ["input", "file"] },
              "ref": { "$ref": "#/$defs/trace_ref" }
            }
          }
        },
        "body": {
          "type": "string",
          "minLength": 1,
          "description": "The Markdown body Phase 2 posts. A dependency is written as the placeholder {{issue:<key>}}, which Phase 2 substitutes with #<number> once the Issue that key names exists; everything else is posted verbatim. It is checked against the planner's own extraction, not merely against this schema."
        }
      }
    },
    "duplicate_suspicion": {
      "type": "object",
      "additionalProperties": false,
      "required": ["issue_key", "kind", "ref", "overlap", "verdict"],
      "properties": {
        "issue_key": { "$ref": "#/$defs/issue_key" },
        "kind": { "enum": ["existing_issue", "merged_pr"] },
        "ref": { "type": "string", "minLength": 1 },
        "overlap": {
          "type": "string",
          "minLength": 1,
          "description": "What actually overlaps, cited. A similar title is not an overlap."
        },
        "verdict": {
          "enum": ["duplicate", "overlapping", "unrelated"],
          "description": "A duplicate verdict only. cmate-issue-refinement's related_issues[].relation carries these three plus 'depends_on' and 'blocks', which are dependency directions rather than duplicate verdicts: those become edges in issues[].depends_on here. See references/plan-contract.md section 7."
        }
      }
    },
    "open_question": {
      "type": "object",
      "additionalProperties": false,
      "required": ["id", "question", "why_blocking", "options", "blocks"],
      "properties": {
        "id": { "type": "string", "minLength": 1, "pattern": "^[a-z0-9]+(?:-[a-z0-9]+)*$" },
        "question": { "type": "string", "minLength": 1 },
        "why_blocking": { "type": "string", "minLength": 1 },
        "options": { "type": "array", "items": { "type": "string", "minLength": 1 } },
        "blocks": {
          "type": "array",
          "description": "Keys this question blocks. A duplicate verdict must be blocked by a question here, so a suspected duplicate cannot be registered silently.",
          "items": { "$ref": "#/$defs/issue_key" }
        }
      }
    },
    "command": {
      "type": "object",
      "additionalProperties": false,
      "required": ["purpose", "command", "mutating", "executed"],
      "properties": {
        "purpose": { "type": "string", "minLength": 1 },
        "command": { "type": "string", "minLength": 1 },
        "mutating": { "type": "boolean" },
        "executed": { "type": "boolean" }
      }
    }
  }
}
